<?xml version="1.0" encoding="UTF-8"?>
<config xmlns="http://www.knime.org/2008/09/XMLConfig" xmlns:xsi="http://www.w3.org/2001/XMLSchema-instance" xsi:schemaLocation="http://www.knime.org/2008/09/XMLConfig http://www.knime.org/XMLConfig_2008_09.xsd" key="settings.xml">
<entry key="node_file" type="xstring" value="settings.xml"/>
<config key="flow_stack"/>
<config key="internal_node_subsettings">
<entry key="memory_policy" type="xstring" value="CacheSmallInMemory"/>
</config>
<config key="model">
<config key="rowFilter">
<entry key="RowFilter_TypeID" type="xstring" value="StringComp_RowFilter"/>
<entry key="ColumnName" type="xstring" value="column1"/>
<entry key="include" type="xboolean" value="true"/>
<entry key="deepFiltering" type="xboolean" value="false"/>
<entry key="CaseSensitive" type="xboolean" value="false"/>
<entry key="Pattern" type="xstring" value="2"/>
<entry key="hasWildCards" type="xboolean" value="false"/>
<entry key="isRegExpr" type="xboolean" value="false"/>
</config>
</config>
<entry key="customDescription" type="xstring" isnull="true" value=""/>
<entry key="state" type="xstring" value="EXECUTED"/>
<config key="nodecontainer_message">
<entry key="type" type="xstring" value="WARNING"/>
<entry key="message" type="xstring" value="Node created an empty data table."/>
</config>
<entry key="factory" type="xstring" value="org.knime.base.node.preproc.filter.row.RowFilterNodeFactory"/>
<entry key="node-name" type="xstring" value="Row Filter"/>
<entry key="node-bundle-name" type="xstring" value="KNIME Base Nodes"/>
<entry key="node-bundle-symbolic-name" type="xstring" value="org.knime.base"/>
<entry key="node-bundle-vendor" type="xstring" value="KNIME GmbH, Konstanz, Germany"/>
<entry key="node-bundle-version" type="xstring" value="3.4.0.qualifier"/>
<entry key="node-feature-name" type="xstring" isnull="true" value=""/>
<entry key="node-feature-symbolic-name" type="xstring" isnull="true" value=""/>
<entry key="node-feature-vendor" type="xstring" isnull="true" value=""/>
<entry key="node-feature-version" type="xstring" value="0.0.0"/>
<config key="factory_settings"/>
<entry key="name" type="xstring" value="Row Filter"/>
<entry key="hasContent" type="xboolean" value="true"/>
<entry key="isInactive" type="xboolean" value="false"/>
<config key="ports">
<config key="port_1">
<entry key="index" type="xint" value="1"/>
<entry key="port_spec_class" type="xstring" value="org.knime.core.data.DataTableSpec"/>
<entry key="port_object_class" type="xstring" value="org.knime.core.node.BufferedDataTable"/>
<entry key="port_object_summary" type="xstring" value="Rows: 0, Cols: 1"/>
<entry key="port_dir_location" type="xstring" value="port_1"/>
</config>
</config>
<config key="filestores">
<entry key="file_store_location" type="xstring" isnull="true" value=""/>
<entry key="file_store_id" type="xstring" isnull="true" value=""/>
</config>
</config>
