<?xml version="1.0" encoding="UTF-8"?>
<config xmlns="http://www.knime.org/2008/09/XMLConfig" xmlns:xsi="http://www.w3.org/2001/XMLSchema-instance" xsi:schemaLocation="http://www.knime.org/2008/09/XMLConfig http://www.knime.org/XMLConfig_2008_09.xsd" key="settings.xml">
    <entry key="node_file" type="xstring" value="settings.xml"/>
    <config key="flow_stack"/>
    <config key="internal_node_subsettings">
        <entry key="memory_policy" type="xstring" value="CacheSmallInMemory"/>
    </config>
    <config key="model"/>
    <config key="nodeAnnotation">
        <entry key="text" type="xstring" value=""/>
        <entry key="contentType" type="xstring" value="text/plain"/>
        <entry key="bgcolor" type="xint" value="16777215"/>
        <entry key="x-coordinate" type="xint" value="0"/>
        <entry key="y-coordinate" type="xint" value="0"/>
        <entry key="width" type="xint" value="0"/>
        <entry key="height" type="xint" value="0"/>
        <entry key="alignment" type="xstring" value="CENTER"/>
        <entry key="borderSize" type="xint" value="0"/>
        <entry key="borderColor" type="xint" value="0"/>
        <entry key="defFontSize" type="xint" value="-1"/>
        <entry key="annotation-version" type="xint" value="20230412"/>
        <config key="styles"/>
    </config>
    <entry key="customDescription" type="xstring" isnull="true" value=""/>
    <entry key="state" type="xstring" value="IDLE"/>
    <config key="nodecontainer_message">
        <entry key="type" type="xstring" value="WARNING"/>
        <entry key="message" type="xstring" value="Contains one node with execution failure (Component Input #1)"/>
        <entry key="issue" type="xstring" value="Component Input #1: Component does not have input data, execute upstream nodes first"/>
    </config>
    <entry key="workflow-file" type="xstring" value="workflow.knime"/>
    <entry key="virtual-in-ID" type="xint" value="1"/>
    <config key="inports">
        <config key="inport_0">
            <entry key="index" type="xint" value="0"/>
            <config key="type">
                <entry key="object_class" type="xstring" value="org.knime.core.node.BufferedDataTable"/>
            </config>
        </config>
        <config key="inport_1">
            <entry key="index" type="xint" value="1"/>
            <config key="type">
                <entry key="object_class" type="xstring" value="org.knime.core.node.BufferedDataTable"/>
            </config>
        </config>
    </config>
    <entry key="virtual-out-ID" type="xint" value="2"/>
    <config key="outports"/>
    <entry key="layoutJSON" type="xstring" value="{&quot;parentLayoutLegacyMode&quot;:false}"/>
    <entry key="configurationLayoutJSON" type="xstring" value="{}"/>
    <entry key="hideInWizard" type="xboolean" value="false"/>
    <entry key="customCSS" type="xstring" value=""/>
</config>
