<?xml version="1.0" encoding="UTF-8"?>
<config xmlns="http://www.knime.org/2008/09/XMLConfig" xmlns:xsi="http://www.w3.org/2001/XMLSchema-instance" xsi:schemaLocation="http://www.knime.org/2008/09/XMLConfig http://www.knime.org/XMLConfig_2008_09.xsd" key="settings.xml">
<entry key="node_file" type="xstring" value="settings.xml"/>
<config key="flow_stack"/>
<config key="internal_node_subsettings">
<entry key="memory_policy" type="xstring" value="CacheSmallInMemory"/>
</config>
<config key="model">
<config key="group_cols_Internals">
<entry key="SettingsModelID" type="xstring" value="SMID_columnfilter"/>
<entry key="EnabledStatus" type="xboolean" value="true"/>
</config>
<config key="group_cols">
<entry key="filter-type" type="xstring" value="STANDARD"/>
<config key="included_names">
<entry key="array-size" type="xint" value="0"/>
</config>
<config key="excluded_names">
<entry key="array-size" type="xint" value="0"/>
</config>
<entry key="enforce_option" type="xstring" value="EnforceExclusion"/>
<config key="name_pattern">
<entry key="pattern" type="xstring" value=""/>
<entry key="type" type="xstring" value="Wildcard"/>
<entry key="caseSensitive" type="xboolean" value="true"/>
</config>
<config key="datatype">
<config key="typelist"/>
</config>
</config>
<config key="retain_order_Internals">
<entry key="SettingsModelID" type="xstring" value="SMID_boolean"/>
<entry key="EnabledStatus" type="xboolean" value="true"/>
</config>
<entry key="retain_order" type="xboolean" value="true"/>
<config key="add_row_duplicate_flag_Internals">
<entry key="SettingsModelID" type="xstring" value="SMID_boolean"/>
<entry key="EnabledStatus" type="xboolean" value="true"/>
</config>
<entry key="add_row_duplicate_flag" type="xboolean" value="true"/>
<config key="add_row_id_flag_Internals">
<entry key="SettingsModelID" type="xstring" value="SMID_boolean"/>
<entry key="EnabledStatus" type="xboolean" value="true"/>
</config>
<entry key="add_row_id_flag" type="xboolean" value="false"/>
<config key="in_memory_Internals">
<entry key="SettingsModelID" type="xstring" value="SMID_boolean"/>
<entry key="EnabledStatus" type="xboolean" value="true"/>
</config>
<entry key="in_memory" type="xboolean" value="false"/>
<config key="remove_duplicates_Internals">
<entry key="SettingsModelID" type="xstring" value="SMID_boolean"/>
<entry key="EnabledStatus" type="xboolean" value="true"/>
</config>
<entry key="remove_duplicates" type="xboolean" value="true"/>
<entry key="row_selection" type="xstring" value="FIRST"/>
<config key="reference_col_Internals">
<entry key="SettingsModelID" type="xstring" value="SMID_string"/>
<entry key="EnabledStatus" type="xboolean" value="true"/>
</config>
<entry key="reference_col" type="xstring" isnull="true" value=""/>
</config>
<entry key="customDescription" type="xstring" isnull="true" value=""/>
<entry key="state" type="xstring" value="IDLE"/>
<config key="nodecontainer_message">
<entry key="type" type="xstring" value="WARNING"/>
<entry key="message" type="xstring" value="At least one column has to be selected for duplicate detection."/>
</config>
<entry key="factory" type="xstring" value="org.knime.base.node.preproc.duplicates.DuplicateRowFilterNodeFactory"/>
<entry key="node-name" type="xstring" value="Duplicate Row Filter"/>
<entry key="node-bundle-name" type="xstring" value="KNIME Base Nodes"/>
<entry key="node-bundle-symbolic-name" type="xstring" value="org.knime.base"/>
<entry key="node-bundle-vendor" type="xstring" value="KNIME AG, Zurich, Switzerland"/>
<entry key="node-bundle-version" type="xstring" value="4.2.0.qualifier"/>
<entry key="node-feature-name" type="xstring" isnull="true" value=""/>
<entry key="node-feature-symbolic-name" type="xstring" isnull="true" value=""/>
<entry key="node-feature-vendor" type="xstring" isnull="true" value=""/>
<entry key="node-feature-version" type="xstring" value="0.0.0"/>
<config key="factory_settings"/>
<entry key="name" type="xstring" value="Duplicate Row Filter"/>
<entry key="hasContent" type="xboolean" value="false"/>
<entry key="isInactive" type="xboolean" value="false"/>
<config key="ports">
<config key="port_1">
<entry key="index" type="xint" value="1"/>
<entry key="port_dir_location" type="xstring" isnull="true" value=""/>
</config>
</config>
<config key="filestores">
<entry key="file_store_location" type="xstring" isnull="true" value=""/>
<entry key="file_store_id" type="xstring" isnull="true" value=""/>
</config>
</config>
