<?xml version="1.0" encoding="UTF-8"?>
<config xmlns="http://www.knime.org/2008/09/XMLConfig" xmlns:xsi="http://www.w3.org/2001/XMLSchema-instance" xsi:schemaLocation="http://www.knime.org/2008/09/XMLConfig http://www.knime.org/XMLConfig_2008_09.xsd" key="settings.xml">
<entry key="node_file" type="xstring" value="settings.xml"/>
<config key="flow_stack"/>
<config key="internal_node_subsettings">
<entry key="memory_policy" type="xstring" value="CacheSmallInMemory"/>
</config>
<config key="model">
<entry key="script" type="xstring" value="# https://www.andrewheiss.com/blog/2016/12/08/save-base-graphics-as-pseudo-objects-in-r/%%00010%%00010knime.out &lt;- data.frame(x = 1:100, y=rnorm(100),%%00010                 z=sample(LETTERS[1:3], 100, replace=TRUE))%%00010"/>
<entry key="templateUUID" type="xstring" isnull="true" value=""/>
<entry key="version" type="xstring" value="version 1.x"/>
<entry key="Output non numbers (NaN, Inf, -Inf) as missing cells" type="xboolean" value="false"/>
<entry key="sendRowNames" type="xboolean" value="true"/>
<entry key="sendBatchSize" type="xint" value="10000"/>
<entry key="knimeInType" type="xstring" value="data.frame"/>
</config>
<config key="nodeAnnotation">
<entry key="text" type="xstring" value="create data"/>
<entry key="bgcolor" type="xint" value="16777215"/>
<entry key="x-coordinate" type="xint" value="8"/>
<entry key="y-coordinate" type="xint" value="119"/>
<entry key="width" type="xint" value="104"/>
<entry key="height" type="xint" value="13"/>
<entry key="alignment" type="xstring" value="CENTER"/>
<entry key="borderSize" type="xint" value="0"/>
<entry key="borderColor" type="xint" value="16777215"/>
<entry key="defFontSize" type="xint" value="11"/>
<entry key="annotation-version" type="xint" value="20151123"/>
<config key="styles"/>
</config>
<entry key="customDescription" type="xstring" isnull="true" value=""/>
<entry key="state" type="xstring" value="EXECUTED"/>
<entry key="factory" type="xstring" value="org.knime.r.RReaderTableNodeFactory"/>
<entry key="node-name" type="xstring" value="R Source (Table)"/>
<entry key="node-bundle-name" type="xstring" value="KNIME R-Project nodes"/>
<entry key="node-bundle-symbolic-name" type="xstring" value="org.knime.r"/>
<entry key="node-bundle-vendor" type="xstring" value="KNIME AG, Zurich, Switzerland"/>
<entry key="node-bundle-version" type="xstring" value="3.7.1.v201901291055"/>
<entry key="node-feature-name" type="xstring" value="KNIME Interactive R Statistics Integration"/>
<entry key="node-feature-symbolic-name" type="xstring" value="org.knime.features.r.feature.group"/>
<entry key="node-feature-vendor" type="xstring" value="KNIME AG, Zurich, Switzerland"/>
<entry key="node-feature-version" type="xstring" value="3.7.1.v201901291055"/>
<config key="factory_settings"/>
<entry key="name" type="xstring" value="R Source (Table)"/>
<entry key="hasContent" type="xboolean" value="true"/>
<entry key="isInactive" type="xboolean" value="false"/>
<config key="ports">
<config key="port_1">
<entry key="index" type="xint" value="1"/>
<entry key="port_spec_class" type="xstring" value="org.knime.core.data.DataTableSpec"/>
<entry key="port_object_class" type="xstring" value="org.knime.core.node.BufferedDataTable"/>
<entry key="port_object_summary" type="xstring" value="Rows: 100, Cols: 3"/>
<entry key="port_dir_location" type="xstring" value="port_1"/>
</config>
</config>
<config key="filestores">
<entry key="file_store_location" type="xstring" isnull="true" value=""/>
<entry key="file_store_id" type="xstring" isnull="true" value=""/>
</config>
</config>
