<?xml version="1.0" encoding="UTF-8"?>
<config xmlns="http://www.knime.org/2008/09/XMLConfig" xmlns:xsi="http://www.w3.org/2001/XMLSchema-instance" xsi:schemaLocation="http://www.knime.org/2008/09/XMLConfig http://www.knime.org/XMLConfig_2008_09.xsd" key="settings.xml">
<entry key="node_file" type="xstring" value="settings.xml"/>
<config key="flow_stack">
<config key="Variable_0">
<entry key="type" type="xstring" value="variable"/>
<entry key="name" type="xstring" value="tmpFilePath"/>
<entry key="class" type="xstring" value="STRING"/>
<entry key="value" type="xstring" value=""/>
</config>
</config>
<config key="internal_node_subsettings">
<entry key="memory_policy" type="xstring" value="CacheSmallInMemory"/>
</config>
<config key="model">
<entry key="scriptImports" type="xstring" value="// Your custom imports:%%00010"/>
<entry key="scriptFields" type="xstring" value="// Your custom variables:%%00010"/>
<entry key="scriptBody" type="xstring" value="// set by unit test%%00010String tmpFilePath = System.getProperty(&quot;blobTmpPath&quot;);%%00010if (tmpFilePath == null || tmpFilePath.isEmpty()) {%%00010%%00009throw new Abort(&quot;No system property denoting file path set&quot;);%%00010}%%00010out_tmpFilePath = tmpFilePath;%%00010%%00010%%00010"/>
<config key="jarFiles">
<entry key="array-size" type="xint" value="0"/>
</config>
<config key="outCols">
<entry key="array-size" type="xint" value="0"/>
</config>
<config key="outVars">
<entry key="array-size" type="xint" value="1"/>
<config key="0">
<entry key="Name" type="xstring" value="tmpFilePath"/>
<entry key="JavaName" type="xstring" value="out_tmpFilePath"/>
<entry key="JavaType" type="xstring" value="java.lang.String"/>
<entry key="Type" type="xstring" value="STRING"/>
<entry key="replaceExisting" type="xboolean" value="false"/>
</config>
</config>
<config key="inCols">
<entry key="array-size" type="xint" value="0"/>
</config>
<config key="inVars">
<entry key="array-size" type="xint" value="0"/>
</config>
<entry key="version" type="xstring" value="version 1.x"/>
<entry key="templateUUID" type="xstring" isnull="true" value=""/>
<entry key="runOnExecute" type="xboolean" value="true"/>
</config>
<entry key="customDescription" type="xstring" isnull="true" value=""/>
<entry key="state" type="xstring" value="CONFIGURED"/>
<entry key="factory" type="xstring" value="org.knime.base.node.jsnippet.JavaEditVarNodeFactory"/>
<entry key="node-name" type="xstring" value="Java Edit Variable"/>
<entry key="node-bundle-name" type="xstring" value="KNIME Java Snippet Nodes"/>
<entry key="node-bundle-symbolic-name" type="xstring" value="org.knime.jsnippets"/>
<entry key="node-bundle-vendor" type="xstring" value="KNIME AG, Zurich, Switzerland"/>
<entry key="node-bundle-version" type="xstring" value="3.6.0.qualifier"/>
<entry key="node-feature-name" type="xstring" isnull="true" value=""/>
<entry key="node-feature-symbolic-name" type="xstring" isnull="true" value=""/>
<entry key="node-feature-vendor" type="xstring" isnull="true" value=""/>
<entry key="node-feature-version" type="xstring" value="0.0.0"/>
<config key="factory_settings"/>
<entry key="name" type="xstring" value="Java Edit Variable"/>
<entry key="hasContent" type="xboolean" value="false"/>
<entry key="isInactive" type="xboolean" value="false"/>
<config key="ports">
<config key="port_1">
<entry key="index" type="xint" value="1"/>
<entry key="port_dir_location" type="xstring" isnull="true" value=""/>
</config>
</config>
<config key="filestores">
<entry key="file_store_location" type="xstring" isnull="true" value=""/>
<entry key="file_store_id" type="xstring" isnull="true" value=""/>
</config>
</config>
