<?xml version="1.0" encoding="UTF-8"?>
<config xmlns="http://www.knime.org/2008/09/XMLConfig" xmlns:xsi="http://www.w3.org/2001/XMLSchema-instance" xsi:schemaLocation="http://www.knime.org/2008/09/XMLConfig http://www.knime.org/XMLConfig_2008_09.xsd" key="settings.xml">
<entry key="node_file" type="xstring" value="settings.xml"/>
<config key="flow_stack"/>
<config key="internal_node_subsettings">
<entry key="memory_policy" type="xstring" value="CacheSmallInMemory"/>
</config>
<config key="model">
<config key="file_out_path_Internals">
<entry key="SettingsModelID" type="xstring" value="SMID_string"/>
<entry key="EnabledStatus" type="xboolean" value="true"/>
</config>
<entry key="file_out_path" type="xstring" value="knime://knime.workflow/../graphic/image.png"/>
<config key="overwrite_ok_Internals">
<entry key="SettingsModelID" type="xstring" value="SMID_boolean"/>
<entry key="EnabledStatus" type="xboolean" value="true"/>
</config>
<entry key="overwrite_ok" type="xboolean" value="true"/>
</config>
<config key="nodeAnnotation">
<entry key="text" type="xstring" value="image.png"/>
<entry key="bgcolor" type="xint" value="16777215"/>
<entry key="x-coordinate" type="xint" value="1028"/>
<entry key="y-coordinate" type="xint" value="579"/>
<entry key="width" type="xint" value="104"/>
<entry key="height" type="xint" value="13"/>
<entry key="alignment" type="xstring" value="CENTER"/>
<entry key="borderSize" type="xint" value="0"/>
<entry key="borderColor" type="xint" value="16777215"/>
<entry key="defFontSize" type="xint" value="11"/>
<entry key="annotation-version" type="xint" value="20151123"/>
<config key="styles"/>
</config>
<entry key="customDescription" type="xstring" isnull="true" value=""/>
<entry key="state" type="xstring" value="CONFIGURED"/>
<config key="nodecontainer_message">
<entry key="type" type="xstring" value="WARNING"/>
<entry key="message" type="xstring" value="Output file '/Users/m_lauber/Dropbox/knime-workspace/examples/kn_example_r_export_data_rdata/k_001_r_export_data/../graphic/image.png' exists and will be overwritten"/>
</config>
<entry key="factory" type="xstring" value="org.knime.base.node.image.writeimage.WriteImageNodeFactory"/>
<entry key="node-name" type="xstring" value="Image Writer (Port)"/>
<entry key="node-bundle-name" type="xstring" value="KNIME Base Nodes"/>
<entry key="node-bundle-symbolic-name" type="xstring" value="org.knime.base"/>
<entry key="node-bundle-vendor" type="xstring" value="KNIME AG, Zurich, Switzerland"/>
<entry key="node-bundle-version" type="xstring" value="4.1.0.v201912041211"/>
<entry key="node-feature-name" type="xstring" value="KNIME Core"/>
<entry key="node-feature-symbolic-name" type="xstring" value="org.knime.features.base.feature.group"/>
<entry key="node-feature-vendor" type="xstring" value="KNIME AG, Zurich, Switzerland"/>
<entry key="node-feature-version" type="xstring" value="4.1.0.v201912041824"/>
<config key="factory_settings"/>
<entry key="name" type="xstring" value="Image Writer (Port)"/>
<entry key="hasContent" type="xboolean" value="false"/>
<entry key="isInactive" type="xboolean" value="false"/>
<config key="ports"/>
<config key="filestores">
<entry key="file_store_location" type="xstring" isnull="true" value=""/>
<entry key="file_store_id" type="xstring" isnull="true" value=""/>
</config>
</config>
