<?xml version="1.0" encoding="UTF-8"?>
<config xmlns="http://www.knime.org/2008/09/XMLConfig" xmlns:xsi="http://www.w3.org/2001/XMLSchema-instance" xsi:schemaLocation="http://www.knime.org/2008/09/XMLConfig http://www.knime.org/XMLConfig_2008_09.xsd" key="settings.xml">
    <entry key="node_file" type="xstring" value="settings.xml"/>
    <config key="flow_stack">
        <config key="Variable_0">
            <entry key="type" type="xstring" value="variable"/>
            <entry key="name" type="xstring" value="variable_1"/>
            <entry key="class" type="xstring" value="STRING"/>
            <entry key="value" type="xstring" value=""/>
        </config>
        <config key="Variable_1">
            <entry key="type" type="xstring" value="variable"/>
            <entry key="name" type="xstring" value="variable_1"/>
            <entry key="class" type="xstring" value="STRING"/>
            <entry key="value" type="xstring" value=""/>
        </config>
    </config>
    <config key="internal_node_subsettings">
        <entry key="memory_policy" type="xstring" value="CacheSmallInMemory"/>
    </config>
    <config key="model">
        <config key="variableCreationTable_Internals">
            <entry key="SettingsModelID" type="xstring" value="SMITID_variables"/>
            <entry key="EnabledStatus" type="xboolean" value="true"/>
        </config>
        <config key="variables">
            <config key="supportedTypes">
                <entry key="array-size" type="xint" value="5"/>
                <entry key="0" type="xstring" value="str"/>
                <entry key="1" type="xstring" value="int"/>
                <entry key="2" type="xstring" value="long"/>
                <entry key="3" type="xstring" value="double"/>
                <entry key="4" type="xstring" value="bool"/>
            </config>
            <config key="types">
                <entry key="array-size" type="xint" value="1"/>
                <entry key="0" type="xstring" value="str"/>
            </config>
            <config key="names">
                <entry key="array-size" type="xint" value="1"/>
                <entry key="0" type="xstring" value="variable_1"/>
            </config>
            <config key="values">
                <entry key="array-size" type="xint" value="1"/>
                <entry key="0" type="xstring" value=""/>
            </config>
        </config>
    </config>
    <entry key="customDescription" type="xstring" isnull="true" value=""/>
    <entry key="state" type="xstring" value="IDLE"/>
    <entry key="factory" type="xstring" value="org.knime.base.node.io.variablecreator.VariableCreatorNodeFactory"/>
    <entry key="node-name" type="xstring" value="Variable Creator"/>
    <entry key="node-bundle-name" type="xstring" value="KNIME Base Nodes"/>
    <entry key="node-bundle-symbolic-name" type="xstring" value="org.knime.base"/>
    <entry key="node-bundle-vendor" type="xstring" value="KNIME AG, Zurich, Switzerland"/>
    <entry key="node-bundle-version" type="xstring" value="5.2.0.v202311171228"/>
    <entry key="node-feature-name" type="xstring" isnull="true" value=""/>
    <entry key="node-feature-symbolic-name" type="xstring" isnull="true" value=""/>
    <entry key="node-feature-vendor" type="xstring" isnull="true" value=""/>
    <entry key="node-feature-version" type="xstring" value="0.0.0"/>
    <config key="factory_settings"/>
    <entry key="name" type="xstring" value="Variable Creator"/>
    <entry key="hasContent" type="xboolean" value="false"/>
    <entry key="isInactive" type="xboolean" value="false"/>
    <config key="ports">
        <config key="port_1">
            <entry key="index" type="xint" value="1"/>
            <entry key="port_dir_location" type="xstring" isnull="true" value=""/>
        </config>
    </config>
    <config key="filestores">
        <entry key="file_store_location" type="xstring" isnull="true" value=""/>
        <entry key="file_store_id" type="xstring" isnull="true" value=""/>
    </config>
</config>
