<?xml version="1.0" encoding="UTF-8"?>
<config xmlns="http://www.knime.org/2008/09/XMLConfig" xmlns:xsi="http://www.w3.org/2001/XMLSchema-instance" xsi:schemaLocation="http://www.knime.org/2008/09/XMLConfig http://www.knime.org/XMLConfig_2008_09.xsd" key="settings.xml">
    <entry key="node_file" type="xstring" value="settings.xml"/>
    <config key="flow_stack"/>
    <config key="internal_node_subsettings">
        <entry key="memory_policy" type="xstring" value="CacheSmallInMemory"/>
    </config>
    <config key="model">
        <entry key="stddeviation" type="xdouble" value="0.1"/>
        <entry key="noise" type="xdouble" value="0.0"/>
        <entry key="patcount" type="xint" value="100"/>
        <entry key="seed" type="xint" value="1020024507"/>
        <config key="clustercount">
            <entry key="array-size" type="xint" value="2"/>
            <entry key="0" type="xint" value="2"/>
            <entry key="1" type="xint" value="2"/>
        </config>
        <config key="unisize">
            <entry key="array-size" type="xint" value="2"/>
            <entry key="0" type="xint" value="2"/>
            <entry key="1" type="xint" value="2"/>
        </config>
    </config>
    <entry key="customDescription" type="xstring" isnull="true" value=""/>
    <entry key="state" type="xstring" value="EXECUTED"/>
    <entry key="factory" type="xstring" value="org.knime.base.node.util.sampledata.SampleDataNodeFactory"/>
    <entry key="node-name" type="xstring" value="Data Generator"/>
    <entry key="node-bundle-name" type="xstring" value="KNIME Base Nodes"/>
    <entry key="node-bundle-symbolic-name" type="xstring" value="org.knime.base"/>
    <entry key="node-bundle-vendor" type="xstring" value="KNIME AG, Zurich, Switzerland"/>
    <entry key="node-bundle-version" type="xstring" value="4.4.0.qualifier"/>
    <entry key="node-feature-name" type="xstring" isnull="true" value=""/>
    <entry key="node-feature-symbolic-name" type="xstring" isnull="true" value=""/>
    <entry key="node-feature-vendor" type="xstring" isnull="true" value=""/>
    <entry key="node-feature-version" type="xstring" value="0.0.0"/>
    <config key="factory_settings"/>
    <entry key="name" type="xstring" value="Data Generator"/>
    <entry key="hasContent" type="xboolean" value="true"/>
    <entry key="isInactive" type="xboolean" value="false"/>
    <config key="ports">
        <config key="port_1">
            <entry key="index" type="xint" value="1"/>
            <entry key="port_spec_class" type="xstring" value="org.knime.core.data.DataTableSpec"/>
            <entry key="port_object_class" type="xstring" value="org.knime.core.node.BufferedDataTable"/>
            <entry key="port_object_summary" type="xstring" value="Rows: 100, Cols: 5"/>
            <entry key="port_dir_location" type="xstring" value="port_1"/>
        </config>
        <config key="port_2">
            <entry key="index" type="xint" value="2"/>
            <entry key="port_spec_class" type="xstring" value="org.knime.core.data.DataTableSpec"/>
            <entry key="port_object_class" type="xstring" value="org.knime.core.node.BufferedDataTable"/>
            <entry key="port_object_summary" type="xstring" value="Rows: 4, Cols: 4"/>
            <entry key="port_dir_location" type="xstring" value="port_2"/>
        </config>
    </config>
    <config key="filestores">
        <entry key="file_store_location" type="xstring" isnull="true" value=""/>
        <entry key="file_store_id" type="xstring" value="f47342bb-ca88-4482-b322-de0660531eb9"/>
    </config>
</config>
