<?xml version="1.0" encoding="UTF-8"?>
<config xmlns="http://www.knime.org/2008/09/XMLConfig" xmlns:xsi="http://www.w3.org/2001/XMLSchema-instance" xsi:schemaLocation="http://www.knime.org/2008/09/XMLConfig http://www.knime.org/XMLConfig_2008_09.xsd" key="settings.xml">
<entry key="name" type="xstring" value="Splitter"/>
<config key="model">
<config key="top">
<entry key="array-size" type="xint" value="2"/>
<entry key="0" type="xstring" value="Universe_0_0"/>
<entry key="1" type="xstring" value="Universe_0_1"/>
</config>
<config key="bottom">
<entry key="array-size" type="xint" value="3"/>
<entry key="0" type="xstring" value="Universe_1_0"/>
<entry key="1" type="xstring" value="Universe_1_1"/>
<entry key="2" type="xstring" value="Cluster Membership"/>
</config>
</config>
<entry key="hasContent" type="xboolean" value="false"/>
<entry key="isInactive" type="xboolean" value="false"/>
<config key="ports">
<config key="port_1">
<entry key="index" type="xint" value="1"/>
<entry key="port_dir_location" type="xstring" isnull="true" value=""/>
</config>
<config key="port_2">
<entry key="index" type="xint" value="2"/>
<entry key="port_dir_location" type="xstring" isnull="true" value=""/>
</config>
</config>
</config>
