<?xml version="1.0" encoding="UTF-8"?>
<config xmlns="http://www.knime.org/2008/09/XMLConfig" xmlns:xsi="http://www.w3.org/2001/XMLSchema-instance" xsi:schemaLocation="http://www.knime.org/2008/09/XMLConfig http://www.knime.org/XMLConfig_2008_09.xsd" key="settings.xml">
    <entry key="node_file" type="xstring" value="settings.xml"/>
    <config key="flow_stack">
        <config key="Variable_0">
            <entry key="type" type="xstring" value="variable"/>
            <entry key="name" type="xstring" value="string-input"/>
            <entry key="class" type="xstring" value="STRING"/>
            <entry key="value" type="xstring" value=""/>
        </config>
    </config>
    <config key="internal_node_subsettings">
        <entry key="memory_policy" type="xstring" value="CacheSmallInMemory"/>
    </config>
    <config key="model">
        <config key="defaultValue">
            <entry key="string" type="xstring" value=""/>
        </config>
        <entry key="hideInWizard" type="xboolean" value="false"/>
        <entry key="customCSS" type="xstring" value=""/>
        <entry key="label" type="xstring" value="Label"/>
        <entry key="description" type="xstring" value="Enter Description"/>
        <entry key="required" type="xboolean" value="true"/>
        <entry key="flowVariableName" type="xstring" value="string-input"/>
        <entry key="regex" type="xstring" value=""/>
        <entry key="error_message" type="xstring" value=""/>
        <entry key="editorType" type="xstring" value="Single-line"/>
        <entry key="multilineEditorWidth" type="xint" value="60"/>
        <entry key="multilineEditorHeight" type="xint" value="5"/>
    </config>
    <entry key="customDescription" type="xstring" isnull="true" value=""/>
    <entry key="state" type="xstring" value="CONFIGURED"/>
    <entry key="factory" type="xstring" value="org.knime.js.base.node.widget.input.string.StringWidgetNodeFactory"/>
    <entry key="node-name" type="xstring" value="String Widget"/>
    <entry key="node-bundle-name" type="xstring" value="KNIME Quick Form Nodes"/>
    <entry key="node-bundle-symbolic-name" type="xstring" value="org.knime.js.quickforms"/>
    <entry key="node-bundle-vendor" type="xstring" value="KNIME AG, Zurich, Switzerland"/>
    <entry key="node-bundle-version" type="xstring" value="4.4.0.qualifier"/>
    <entry key="node-feature-name" type="xstring" isnull="true" value=""/>
    <entry key="node-feature-symbolic-name" type="xstring" isnull="true" value=""/>
    <entry key="node-feature-vendor" type="xstring" isnull="true" value=""/>
    <entry key="node-feature-version" type="xstring" value="0.0.0"/>
    <config key="factory_settings"/>
    <entry key="name" type="xstring" value="String Widget"/>
    <entry key="hasContent" type="xboolean" value="false"/>
    <entry key="isInactive" type="xboolean" value="false"/>
    <config key="ports">
        <config key="port_1">
            <entry key="index" type="xint" value="1"/>
            <entry key="port_dir_location" type="xstring" isnull="true" value=""/>
        </config>
    </config>
    <config key="filestores">
        <entry key="file_store_location" type="xstring" isnull="true" value=""/>
        <entry key="file_store_id" type="xstring" isnull="true" value=""/>
    </config>
</config>
